{
  "$schema": "./progress-bar-config.schema.json",
  "ProgressBar": {
    "EnableLoopingProgress": true,
    "AnimationIntervalMs": 100,
    "MinIntervalForLooping": 0.1,
    "MaxIntervalForLooping": 100.0
  },
  "JITPolling": {
    "EnableJITPolling": true,
    "TriggerWindowMs": 150,
    "MinPredictionTimeMs": 100,
    "MaxJITAttemptsPerCycle": 1,
    "AdaptivePollingEnabled": true,
    "MinPollingIntervalMs": 200,
    "MaxPollingIntervalMs": 2000,
    "HealthCriticalThreshold": 0.3,
    "HealthLowThreshold": 0.5,
    "CriticalHealthPollingMs": 500,
    "LowHealthPollingMs": 1000,
    "NormalPollingMs": 2000
  },
  "HPAnimation": {
    "TransitionDurationMs": 120,
    "TransitionTimingFunction": "linear",
    "EnableSmoothTransition": true,
    "PlayerHPTransitionMs": 120,
    "EnemyHPTransitionMs": 120
  },
  "SignalRIncrementalUpdate": {
    "EnableIncrementalUpdate": true,
    "EnableAttackTickUpdate": true,
    "EnableSkillCastUpdate": true,
    "EnableDamageAppliedUpdate": false,
    "ClientPredictionEnabled": true,
    "MaxPredictionAheadMs": 500,
    "SyncThresholdMs": 100,
    "ResetProgressOnMismatch": true
  },
  "Debug": {
    "LogProgressCalculations": false,
    "LogJITPollingEvents": false,
    "ShowProgressDebugInfo": false,
    "LogSignalREvents": false,
    "LogIncrementalUpdates": false
  }
}
